{
  "$schema": "https://json-schema.org/draft/2020-12/schema",
  "$id": "https://rec.app/spec/transcript.schema.json",
  "title": "rec transcript",
  "description": "{base}.transcript.json in the recording folder. See docs/recly.md \u00a78.",
  "type": "object",
  "additionalProperties": false,
  "required": [
    "schema",
    "recordingId",
    "track",
    "language",
    "provider",
    "createdAt",
    "durationSec",
    "speakers",
    "segments"
  ],
  "properties": {
    "schema": {
      "enum": [
        1,
        2
      ]
    },
    "recordingId": {
      "type": "string",
      "pattern": "^[0-7][0-9A-HJKMNP-TV-Z]{25}$"
    },
    "track": {
      "type": "string",
      "enum": [
        "mono",
        "mix"
      ]
    },
    "language": {
      "type": "string",
      "minLength": 1
    },
    "provider": {
      "type": "object",
      "additionalProperties": false,
      "required": [
        "name"
      ],
      "properties": {
        "name": {
          "type": "string",
          "minLength": 1
        },
        "model": {
          "type": "string",
          "minLength": 1
        },
        "jobRef": {
          "type": "string",
          "minLength": 1
        }
      }
    },
    "createdAt": {
      "type": "string",
      "format": "date-time"
    },
    "editedAt": {
      "description": "When the user last changed this transcript's text, speaker names or segment speakers in the app. Absent on a transcript nobody edited. See docs/recly.md section 8 \"Editing\".",
      "type": "string",
      "format": "date-time"
    },
    "durationSec": {
      "type": "number",
      "minimum": 0
    },
    "speakers": {
      "type": "array",
      "items": {
        "type": "object",
        "additionalProperties": false,
        "required": [
          "id"
        ],
        "properties": {
          "id": {
            "type": "string",
            "pattern": "^S[1-9][0-9]*$"
          },
          "name": {
            "type": [
              "string",
              "null"
            ]
          },
          "me": {
            "description": "True for the person who made the recording, told apart on a desktop by its microphone track while the system-audio track is quiet. Absent for everyone else. See docs/recly.md section 8 \"Me and others\".",
            "const": true
          }
        }
      }
    },
    "segments": {
      "type": "array",
      "items": {
        "type": "object",
        "additionalProperties": false,
        "required": [
          "start",
          "end",
          "speaker",
          "text"
        ],
        "properties": {
          "start": {
            "type": "number",
            "minimum": 0
          },
          "end": {
            "type": "number",
            "minimum": 0
          },
          "speaker": {
            "type": "string",
            "pattern": "^(S[1-9][0-9]*)?$"
          },
          "text": {
            "type": "string"
          },
          "words": {
            "type": "array",
            "items": {
              "type": "object",
              "additionalProperties": false,
              "required": [
                "start",
                "end",
                "text"
              ],
              "properties": {
                "start": {
                  "type": "number",
                  "minimum": 0
                },
                "end": {
                  "type": "number",
                  "minimum": 0
                },
                "text": {
                  "type": "string"
                }
              }
            }
          }
        }
      }
    },
    "speakerIdentification": {
      "enum": [
        "identified",
        "unavailable"
      ]
    },
    "timing": {
      "enum": [
        "segment",
        "word"
      ]
    }
  },
  "allOf": [
    {
      "if": {
        "properties": {
          "schema": {
            "const": 1
          }
        },
        "type": "object"
      },
      "then": {
        "properties": {
          "speakers": {
            "minItems": 1,
            "type": "array"
          },
          "speakerIdentification": false,
          "timing": false,
          "segments": {
            "items": {
              "properties": {
                "speaker": {
                  "pattern": "^S[1-9][0-9]*$",
                  "type": "string"
                }
              },
              "type": "object"
            },
            "type": "array"
          }
        },
        "type": "object"
      },
      "else": {
        "required": [
          "speakerIdentification",
          "timing"
        ]
      }
    },
    {
      "if": {
        "required": [
          "speakerIdentification"
        ],
        "properties": {
          "speakerIdentification": {
            "const": "unavailable"
          }
        },
        "type": "object"
      },
      "then": {
        "properties": {
          "speakers": {
            "maxItems": 0,
            "type": "array"
          },
          "segments": {
            "items": {
              "properties": {
                "speaker": {
                  "const": ""
                }
              },
              "type": "object"
            },
            "type": "array"
          }
        },
        "type": "object"
      }
    },
    {
      "if": {
        "required": [
          "speakerIdentification"
        ],
        "properties": {
          "speakerIdentification": {
            "const": "identified"
          }
        },
        "type": "object"
      },
      "then": {
        "properties": {
          "speakers": {
            "minItems": 1,
            "type": "array"
          },
          "segments": {
            "items": {
              "properties": {
                "speaker": {
                  "pattern": "^S[1-9][0-9]*$",
                  "type": "string"
                }
              },
              "type": "object"
            },
            "type": "array"
          }
        },
        "type": "object"
      }
    }
  ]
}
